{
  "event_id": "01929a2b-7c3d-7e4f-8a5b-6c7d8e9f2001",
  "event_type": "equipment.state.changed",
  "schema_version": 2,
  "source_id": "edge-weld-1",
  "source_seq": 201,
  "source_kind": "machine",
  "reliability": "high",
  "occurred_at": "2026-09-25T10:15:30.123Z",
  "correlation_id": "01929a2b-7c3d-7e4f-8a5b-000000000001",
  "causation_id": null,
  "item_id": "ENT01:FL-0007",
  "integrity": {
    "format_version": 1,
    "crypto_profile": "gost",
    "signers": [
      "device-edge-weld-1@1"
    ]
  },
  "data": {
    "equipment_id": "IS-1",
    "station_id": "weld-2",
    "code": "I_HIGH",
    "parameter": "current",
    "value": {
      "value": 1780,
      "scale": 1,
      "unit": "A"
    },
    "setpoint": {
      "nominal": {
        "value": 160,
        "scale": 0,
        "unit": "A"
      },
      "lower": {
        "value": 150,
        "scale": 0,
        "unit": "A"
      },
      "upper": {
        "value": 170,
        "scale": 0,
        "unit": "A"
      }
    },
    "execution": "unknown",
    "controller_mode": "unknown",
    "condition": "warning"
  }
}
